upvotes,dadjoke
14943,"Can w‌‌e b‌‌an “‌‌Yo M‌‌omma” j‌‌okes? T‌‌hey’re o‌‌ld, s‌‌tupid, a‌‌nd h‌‌ave b‌‌een d‌‌one b‌‌y l‌‌iterally e‌‌veryone h‌‌undreds o‌‌f t‌‌imes   

Just l‌‌ike y‌‌o momma"
14931,What do you call a typo on a headstone? A grave mistake.
14925,"r/dadjokes, please keep my family in your prayers. We just found out my grandpa is addicted to Viagra. Nobody's taking it harder than grandma."
14928,If you rearrange the letters of MAILMEN They get really upset.
14914,"My wife looked at my son (7) yesterday and told him his shoes were on the wrong feet Without missing a beat he said ""They can't be, these are the only feet I have""

Proud dad moment!"
14874,"Yesterday I confused the words ""jacuzzi"" and ""yakuza"".  Now I'm in hot water with the Japanese mafia."
14875,I just saw 10 ants frantically running around my kitchen. I felt bad so I built them a small house. Now I’m their landlord and I collect rent from my tenants.
14863,"My wife screamed in pain during labor so I asked, “What’s wrong?”. She screamed. “These contractions are going to kill me!!” “I am sorry, honey,” I replied. “What is wrong?”"
14856,William Shatner has discontinued his line of ladies lingerie. Apparently Shatner panties was a poor choice of name.
14842,"I asked my son to go get me a phone book. He laughed, called me a dinosaur, and handed me his iPhone. The spider is dead, the iPhone screen is cracked, and my son is furious!"
14847,"Three dinosaurs come across a magical lamp. The first dinosaur rubs it and a genie appears.

""I have three wishes. One for each of you,"" the genie says. 

The first dinosaur doesn't hesitate before his request ""All right, I'll have a big, juicy piece of meat."" Immediately, a big, juicy piece of meat appears in front of him. 

Instantly envious, the second dinosaur speaks up. ""Well, I want a shower of meat!"" As soon as he utters his wish, a shower of meat rains down upon him.

The third dinosaur, not to be outdone, has to think for a second about what could possibly be better than a shower of meat.

""Aha, I've got it!"" he proclaims. ""I'll have a meatier shower!"""
14810,(WARNING 18+) 19
14809,"A guy walks into the bank, pulls out a gun, points it at the teller and screams, “Give me all your money or you’re geography!” 



The teller replies, “Don’t you mean history?”

The robber says, “Don’t change the subject!"""
14800,What’s the oldest age someone could get a circumcision? I just want to know the cutoff date.
14802,Gonorrhea would've been a great name for diarrhea medicine Change my [pants] mind.
14794,"True Story My wife and I went to the hospital today for our final follow up after she had a miscarriage earlier this week (sad face). The room was full of 2 nurses, 2 interns doing residencies, and our doctor. He told us the good news that we can start trying again as soon as we’re ready. I immediately replied “well can you give us the room or do you want to stick around and watch?” That got a real belly laugh from everyone, including my wife, and broke up a lot of the tension in the room. Just thought I would share this dad (to be) joke"
14776,"“Officer, are you crying while writing me a ticket?” Cop: it’s a .....moving violation."
14739,Straw. Straw. Straw. Straw. Straw. Straw. Straw. Straw. Straw. Straw. Straw. Straw. Straw. Straw. Straw. Straw. Straw. Straw. Straw. Straw. Straw. Straw. Straw. Straw. Straw. Straw. Straw. Straw. Straw. Straw. Straw. Straw. Straw. Straw. Straw. Straw. Straw. Straw. Straw. Straw. Straw. That's it. The last straw.
14740,Genie: What is your final wish? Boy: I wish I were you. Genue: weurd but alrught.
14735,"As a doctor, I'm addicted to hitting my patients on their knees I really get a kick out of it"
14730,"My 9 year old wanted me to post her joke here! What does it mean when you find horseshoes?
 It means a horse is walking round in its socks!

I am so proud of her!
Edit: wording."
14694,"I told my 3yr old daughter ""I'm tired."" ""Oh. I thought you were daddy!""

I've never been so proud."
14679,"My friend couldn't afford to pay his water bill So I sent him a ""get well soon"" card"
14656,"I dislike karma whores who make posts that imply it's their cake day, simply for upvotes. I won't be doing that today!"
14651,People are usually shocked when they find out I'm not a very good electrician.
14637,"What do you call a person missing 75%, of their spine? A quarterback."
14634,I just saw a cashier scan the eyes of a rude customer with her barcode reader. The look on his face was priceless.
14587,"I told my daughter, “Go to bed, the cows are sleeping in the field.” Puzzled, she asked, “What’s that got to do with anything?” I chuckled, ""Well, that means..."" 

""It’s pasture bedtime!”"
14574,"On his deathbed, my grandfather said, “Remember these two words. It’ll open a lot of doors for you in life.” Push and Pull."
14568,"What is an Air Fryer's favorite food? (Courtesy of my 6 year old) Air-vrything.


I'm so proud."
14498,"My birthday is on July 24th, shame I was born in america. If I was born anywhere else.... my birthday would be 24/7"
14491,"Picture this: A pandemic is unleashed by ticks that live on and around the mouths of alpacas. Global chaos ensues.

The disease wipes out 99% of humanity, and the desperate survivors are forced to live in a post-alpaca lip tick wasteland."
14482,"A witch was flying on her broom when she noticed that all the witches she passed were flying on vacuum cleaners. She thought to herself, ""Am I the only one who still drives a stick?"""
14478,What's made of leather and sounds like a sneeze? A shoe..
14471,My sewing instructor just told me that I’m the worst student she has ever seen. Shit. Wrong thread.
14476,"I got an email from Google saying ""At Google Earth, we are able to read maps backwards!"" and I thought; ""That's just spam!"""
14462,"When my wife caught me standing on the bathroom scales, sucking in my stomach, she laughed, “Ha! That’s not going to help!” 

“Sure, it does.” I said. “It’s the only way I can see the numbers.”"
14419,We all know that Albert Einstein was a genius... But very few people know his brother Frank was a monster.
14395,Lance is an uncommon name nowdays  But in mediaeval times people were called lance a lot
14370,"After I was arrested, my ex-wife decided to hang a picture of my mugshot on the wall in her living room. But she still won't admit she framed me."
14337,"For me, the urge to sing “The Lion Sleeps Tonight” is always just a whim away...  **a whim away, a whim away, a whim away, a whim away**"
14334,Iamonthemoonandthereisnowheretogetabeer. Thereisnospacebar.
14327,"A vegan said to me, “People who sell meat are disgusting!” I said, “People who sell fruits and vegetables are grocer.”"
14324,"If a father in Iraq gifts his daughter a new bag, what will she say? Thanks for the Baghdad!"
14307,"eBay is so useless I tried to look up lighters and all they had were 13,570 matches"
14255,So the doctor sat me down and gently revealed to me me that my child is a boy trapped in a girls body... ...Until my wife gives birth that is. Only three more months to go!
14221,"BREAKING: Russia has struck its own submarine with an underwater torpedo in the Black Sea, killing all 69 aboard Whoops wrong sub"
14226,I’m so bored that I just memorized six pages of the dictionary. I learned next to nothing.
14225,"I finally got my dream job at the guillotine factory I’ll beheading there shortly




Edit: Thanks for the silver. My first ever award!"
14226,"Interviewer: Can you explain these 4 jobless years in your resume? Applicant: That's when I went to Yale. Interviewer: Impressive! You are hired!

Applicant: Thanks, I really need this yob."
14216,This subreddit is 10 years old now. I'm surprised it hasn't decade.
14217,My son Luke loves that we named him after a Star Wars character. My daughter Chewbacca not so much
14214,Stopped by a roadside stand that said lobster tails $2. I paid my $2 and he said... Once upon a time there was this lobster...
14199,"I was watching Star Wars with my daughter. She asked why Luke was climbing inside a Tauntaun, I said to keep warm. She asked how warm is it inside. I said Lukewarm."
14194,I ordered a chicken and an egg from Amazon. I’ll let you know
14189,"I said to my wife, ""I need to call the doctor today."" 
""Which doctor?"" she asked.

""No, the regular kind."""
14176,"My daughter came into my ""home office"" (closet) and said, ""You wanna hear a joke?"" I told her that I did 

Daughter: ""Quarantine.""

Me: . . . 

Daughter: ""You don't get it. It's an inside joke."""
14174,How much did it cost HYDRA to kill Tony Stark’s parents? One Buck.
14164,Iamonthemoonandthereisnoplacetogetabeer. Youmightsaythereisnospacebar.
14167,I accidentally drank some Holy Water with my laxative. I'm about to start a religious movement.
14159,"A woman brought a very limp duck into a veterinary surgeon. As she laid her pet on the table, the vet pulled out his stethoscope and listened to the bird's chest. After a moment or two, the vet shook his head and sadly said, ""I'm sorry, your duck, Cuddles, has passed away.""

The distressed woman wailed, ""Are you sure?"" ""Yes, I am sure. Your duck is dead,"" replied the vet..

""How can you be so sure?"" she protested. ""I mean you haven't done any testing on him or anything. He might just be in a coma or something.""

The vet rolled his eyes, turned around and left the room. He returned a few minutes later with a black Labrador Retriever. As the duck's owner looked on in amazement, the dog stood on his hind legs, put his front paws on the examination table and sniffed the duck from top to bottom. He then looked up at the vet with sad eyes and shook his head.

The vet patted the dog on the head and took it out of the room. A few minutes later he returned with a cat. The cat jumped on the table and also delicately sniffed the bird from head to foot. The cat sat back on its haunches, shook its head, meowed softly and strolled out of the room.

The vet looked at the woman and said, ""I'm sorry, but as I said, this is most definitely, 100% certifiably, a dead duck.""

The vet turned to his computer terminal, hit a few keys and produced a bill, which he handed to the woman..

The duck's owner, still in shock, took the bill. ""$1500!"" she cried, ""$1500 just to tell me my duck is dead!""

The vet shrugged, ""I'm sorry. If you had just taken my word for it, the bill would have been $50, but with the Lab Report and the Cat Scan, it's now $1500."""
14160,"My WiFi password is ""writtenontherouter""... ..and I let all my guest walk to the router and let them unsuccessfully try to use the initial password until I tell them it's literally ""writtenontherouter""."
14153,Why did the wizard’s wife have hickeys on her neck? Because he was a neck-romancer.
14156,Whenever my wife is upset I let her color in my black and white tattoos She just really needed a shoulder to crayon
14141,Justice is a dish best served cold Because if it were served warm it would be justwater
14125,My wife left me because of my gambling addiction But I know I can win her back
14115,Why shouldn't you kiss anyone on January 1st? Because it's only the first date
14097,I asked my wife if I was the only one she ever slept with. She said yes. The others were either sevens or eights.
14061,"My best dad joke... I did it to my wife I made my bowl of Yogurt, I then squeezed some honey on it in a ""B"".

I told my wife, from across the kitchen ""there's a honeybee in my yogurt!""

She comes over, looks in the bowl, and says only ""its 6 o'clock in the morning."" I could hear her eyes roll. 

It was great!

I'm 42 btw."
14057,My name is ABCDEFGHIJKMNOPQRSTUVWXYZ It’s pronounced “Noel.”
14025,"The owner of the tuxedo store kept hovering over me when I was browsing, so I asked him to leave me alone. He said, “Fine. Suit yourself.”"
13982,"Customer: Do you have any copies of that book for men with small penises? Book Store Employee: I don’t know if it’s in yet.
Customer: Yes! That’s the one!"
13982,"79% of people don’t know opposite words for the following: 
1) Always
2) Coming
3) From
4) Take
5) Me
6) Down"
13980,British people be like: I'm bri ish I guess they drank the t
13970,"My teacher likes to start every day by reading a joke from Reddit. She was sick the other day, so A subreddit."
13962,"My 8 year old pulled this on me Daughter: Dad, are you smart?

Me: Yes. 

Daughter: Spell it. 

Me: S-M-A-R-T

Daughter: You said you’re smart but you can’t even spell the word “it.”

She got me good. 

—

Edit: My first front page post! I’d like to say thanks  to all the wonderful people that upvoted this and made awesome comments. And screw you to the weirdos who went out or their way to say mean things. And thanks to my daughter. She is the real MVP in all this."
13953,This sub is disappointing me lately. I'm going to try the meatball next time.
13944,"A man is staying in a hotel. He walks up to the front desk and says, “Sorry, I forgot what room I’m in, can you help me?”

The receptionist replies, “No problem, sir. This is the lobby.”"
13933,Chinese take out: 8 dollars. Tip: 2 dollars. Getting home to find out they forgot part of your order... Riceless
13940,"If you could get rid of one race which one would it be and why? I would get rid of the marathon. Running 26.2 miles is just crazy!

EDIT: thank you for the 100 upvotes! I’m telling my gf I’m famous!

2nd EDIT:  I work the night shift at my job and I just woke up to fricken 5.8k arrows pointing up!? This is awesome!!

3rd EDIT:  request for a third edit,  currently it’s 13:41 (central time) And I’m drinking coffee reading the comments. There’s a lot of people that thinks this is a f1 and or nascar question.

4th EDIT:  the celebrity status is overwhelming me. People are stopping me on the streets asking for my autograph and selfies. About to go in for work now. I had to hire a bodyguard to follow me around. Thank you all. This is a blessing and a curse at the same time. If I don’t have a 5th edit later that means a crazy fan has held me captive.

5th EDIT: made it to work safe thank god. Elon musk himself sent me a tweet congratulating me on my accomplishments on Reddit the last 18 hours since this post,  also told me to buy a doggy coin or something… anyway I find myself checking my phone every minute reading new comments. The popularity has consumed my mind. I cannot get any work done and the manager on duty is getting upset with me but then I remember I am the manager on duty for the night shift so I’m ok. I’m slowly going crazy for the need for more of those red, pointing up arrow thingys. It’s destroying me."
13916,"My 4 year old was taking her sweet time getting ready for bed and I said to her ""quit stallin!"" She said to me, ""I'm not stallin""

And I replied, ""well, you might be right about that because you're certainly not Russian.'

I got nothing... no laughs, even after I thoroughly explained it to her. My daughter has no sense of humor."
13906,Cop: I’m arresting you for illegally downloading the entire Wikipedia. Man: Wait. I can explain everything!
13884,My kid came out to me as trans and asked if I still accepted them for who they are. I told them quite clearly that I loved them no matter what they chose. I was being transparent.
13885,My wife left me cause Im too insecure Never mind she was just at the grocery store
13879,"The internet connection in my farm is really sketchy, so I moved the modem to the barn. Now I have stable wifi."
13871,To call the whole Elon Musk controversy “Elon-Gate” seems like a bit of a stretch
13857,Today I launched a book aimed at 9-12 year olds. I’m proud to say I managed to hit one of the little shits!
13862,"My son said: “Dad, once I reach 99 pounds, I will eat one pound of nachos. Then I will be 99% your son and 1% nacho son.”"
13848,"I told my son I was named after Thomas Jefferson… He said, “But dad, your name is Brian.”

I said, “I know, but I was named AFTER Thomas Jefferson.”"
13824,"Without a doubt, my favourite Robin Williams movie is Mrs Fire. Edit: Thanks for my first ever Gold! I have no idea what it does but it sure is shiny =]"
13817,"As a lumberjack, I know that I’ve cut exactly 2,417 trees. I know because every time I cut one, I keep a log."
13803,"What noise does a 747 make when it bounces? Boeing, Boeing, Boeing."
13800,"A drunk wakes up in jail, ""Why am I here officer?"" ""For drinking."" replies the cop.

""Great"" says the man. ""When do we start?"""
13794,"My 8yr old daughter got me with ""I can breathe under water"" She filled a cup of water placed it on her head and began to violently and rapidly breathe in and out. The force is strong with her."
13788,"What do you say to your sister when she's crying? ""Are you having a crisis?"""
13774,Breaking a leg during an audition ensures that you end up in the cast.
13753,It's easy to convince ladies not to eat Tide Pods But its harder to deter gents
13743,"I married my wife for her looks Just not the ones she been giving me lately.


Thanks for the silver ❤️"
13749,"Every time I go to the liquor store, a dude comes out of nowhere to give me advice on what to buy. He’s my spirit guide.

Edit: Thanks guys."
13722,"My friend in Germany says that there has been panic buying of sausages and cheese . . . It's the Wurst Käse scenario

Credit: Twitter, Bruce Lawson (@brucel)"
13718,"Someone: ""If you need 144 rolls of toilet paper for a 14 day quarantine you probably should've been seeing a doctor long before COVID-19"" My response: ""144? That's a gross"""
13715,"Why didn’t 4 ask out 5? He was 2^2

Edit: wow, this stupid joke is at the top of the hot posts somehow (at the time of this edit), rip to my Reddit notifications lol, thank you all, happy groaning."
13715,I was drinking my milkshake on a cliff and thought Wow this is ledge ‘n dairy
13680,"I just saw my wife trip and fall, while carrying a laundry basket full of ironed clothes. I watched it all unfold."
13667,"My son told me he didn't understand cloning. I told him, 'that makes two of us'."
13646,What did Master Yoda say when he first saw himself in 4k resolution? HDMI
13643,What did 2n+1 say to 2n? I literally can't even
13638,"What word starts with ""e"", ends with ""e"", and only has one letter in it?  Envelope."
13633,Why don't the Jedi take off their shirts to greet each other? Because only a Sith deals in ab salutes.
13573,"Waiter: I see you glass is empty, would you like another one? Dad: Why would I want two empty glasses?"
13569,"If A is for Apple and B is for Banana, then what is C for? Plastic explosives."
13576,"My wife rang me at the pub and said, “If you’re not home in 10 minutes, I’m giving the dinner I cooked you to the dog.” I was home in 5 minutes. I’d hate for anything to happen to the dog."
13548,"I made a playlist for hiking. It has music from Peanuts, The Cranberries, and Eminem. I call it my Trail Mix"
13521,The mayor in my city just passed law that male best friends have to have lunch together at least once a week Well it’s not a law it’s a mandate
13504,How come the Hulk doesn’t lose his pants when he transforms? The scientific experiments altered his jeans
13507,"My 10 Year Old ""Dad Joked"" Me This Weekend He walked into my room and says, ""Hey dad, can you take a picture of me?""

I thought it was a weird request, but said, ""Sure.""

As I'm reaching for my phone, he pulls out a framed picture of himself from behind his back he had taken off one of our shelves, hands it to me, and says, ""Ok, thanks!"" and walks out without even cracking a smile.

I stared at that picture for a few seconds in proud silence.

\*edit/update\* Wow... I woke up this morning and noticed a ton of notifications.  This made my 10 year old very happy so thank you.  And thank you for the awards as well.  Totally unexpected and unnecessary but very appreciated."
13504,"I told the cop, “You can’t write me a ticket. I have a marathon to run tomorrow.” The cop said, “Sir, that’s not how you play the race card.”"
13486,"Imagine being held at gunpoint by (bear with me) a literate animal, and the only hope of rescue is (BEAR WITH ME) posting a coded message on social media. w**H**o the h**E**ll would be**L**ieve such a thing can hap**P**en."
13472,"If Snoop Dogg dies before pot becomes legal in the US, he will be rolling in his grave."
13483,A slice of apple pie is $2.50 in Jamaica and $3.00 in the Bahamas. These are the pie rates of the Caribbean.
13475,"My 77 year old dad said this last night So we were out celebrating my dad’s birthday last night.  I said,  “You and Mom are healthy and look good for your age.  I wish I had your genes!”  (I’m adopted.)  Without missing a beat, Dad said,  “You can have mine if you want, I can barely fit in them anymore!”"
13469,If I had 50 cents for every maths Exam I failed I’d have $8.40.
13460,"I hate it when my wife says ""Are you listening to me?!"" Such a random way to start a conversation."
13449,"Burnt my hawaiian pizza today... Should have cooked it on aloha temperature.


EDIT: Thanks for the awards, y'all!"
13440,I told my wife we could still have a threesome during this Coronavirus pandemic. There would be six feet between us.
13442,Grandpa died because we couldn’t figure out his blood type. At least he told us to be positive.
13443,"Picture this: A pandemic is unleashed by ticks that live on and around the mouths of alpacas. Global chaos ensues, the disease wipes out 99% of humanity and desperate survivors are forced to live in... ...a post-alpaca lip tick wasteland."
13429,How do you make a water bed more bouncy? Add Spring Water.
13420,Why won't swords go obsolete? They are cutting edge technology.
13414,"The internet connection at my farm is really sketchy, so I moved the modem to the barn. Now I have stable wifi."
13404,What’s the difference between Taxes and Texas? Taxes can keep your electrical grid operational.
13401,A new strain of head lice is going around which is resistant to conventional treatments. That has left scientists scratching their heads.
13378,"A blonde goes into a church and asks the minister, ""How much does it cost to rent a church singing group?""He said,""Do you mean a choir?"" She said ""Fine... How much does it cost to acquire a church singing group?"""
13371,"My 10 year old came in with a piece of paper and said “Dad, I’ve got a joke for you.” Then she ripped it in half and said, “Never mind, it’s tearable.”  

I feel like I’ve succeeded as a dad."
13369,"From my 5-year-old son: ""Hey"" True story; it even happened last night. My 5-year-old son walks up behind me and out of the blue says, ""hey.""

I turn to him and say, ""yeah, kiddo? What's up?""

He responds, ""it's dead grass.""

I'm really confused and trying to figure out what's wrong and what he wants from me. ""What? There's dead grass? What's wrong with that?""

.

.

.

He says, totally straight-faced, ""hay is dead grass,"" and runs off."
13376,To every last man out there celebrating Fathers Day... [NSFW] All of you are real mother fuckers.
13369,"Apparently not a joke I'm a son without a father... I lost him a few days ago to a heart attack and I just... can't stop crying 

We both used to check out this sub daily for amazing dad jokes and laugh at them together... We'd try to form our own stupid stuff

I used to wake up for college early in the morning 
I'd cook some breakfast for him get ready and before leaving I'd wake him up and tell him a stupid dad joke... I'd want to see him start his day with a smile

I just want to thank you all in this sub for giving me and my dad happiness your jokes made us laugh at our worst times

Out of habit I keep getting up to go to his room with a dad joke... Only to see it empty

I'm never gonna get to mess around with my dad again... I'm never going to hang out with him again he's not going to be there to see me grow up and buy a house of my own ... He's not going to see me buy a car of own ... He's not going to see me get married... He's gone forever and I will never get to start my day with a smile again from a silly dad joke with him

He wasn't the greatest dad but he certainly was the best I could ever ask for ... I will miss you dad

Thank you r/dadjokes to all the amazing dads here and their funny and stupid jokes

Edit : thank you so much dad's for your overwhelming support I love you guys and I just want to take a moment to thank all the people here who shared their experiences as well of having lost a parent... Your story inspires me to continue forward with the torch

Also I'm seeing quite a few comments saying the post is not funny and that they came for a laugh... I'm truly sorry about that, I just really wanted to honor my dad in this sub since we spent so much time together here scrolling for jokes and I needed the push from you dads to get back on my feet

I'm never going to be the same that's for sure knowing a peice of me has been lost forever... The void will never be filled in my heart
But your support is just what I needed, once again thank you dads I love you

Edit 2: thank you so much dads for your overwhelming support
I know I haven't been able to respond to all the dms and messages here but I've been reading them all and it's just made me smile in the worst
Thank you dads you guys are the best"
13363,"Theresa May is stepping down on June 7th. As a result, the last week of May is the first week of June."
13362,"Justice is a dish best served cold, if it were served warm it would be justwater"
