upvotes,dadjoke
13334,"My Daughter turned 18 over the weekend, so I bought her a locket with a picture of herself inside. Thankfully, she's now finally.. Independent.."
13330,Two women were sharing the same ID card Sharon is Karen
13303,"What did the green grape say to the purple grape? Breathe, damn it! Breathe!"
13291,"Two drunk guys were about to get into a brawl. One of the guys grabs a stick and draws a line in the dirt and says ""If you cross this line, I'll hit you in the face"". That was the punchline"
13273,What did the ghost say to the beehive? Boobees
13265,What did the sushi say to the bee? Wasabi
13263,What do you call a hen who counts her eggs? A mathemachicken
13257,"Which is faster, hot or cold? Hot, because you can catch a cold."
13255,I was gonna tell a time traveling joke. But you guys didn't like it.
13240,"An actual conversation between my wife and my son yesterday. My wife has been teaching my son to fold his own laundry but he complains about it everytime. My wife, trying to convince my son, said to him ""If you pick up this habit, your future wife will love you very much.""

My son replied ""I don't want my future wife to love me very much. I want my future wife to help me fold my laundry.""

I busted out laughing. But the end result is that now I have to fold my own laundry going forward."
13235,Why are locksmiths allowed to remain open during lockdown? They are key workers
13221,A ham sandwich walks into a bar and orders a beer The bartender says we don't serve food here
13204,No one in Antarctica has COVID-19 It's because they are ice-o-lated.
13208,"A woman suddenly in labor shouts, shouldn’t! wouldn’t! couldn’t! didn’t! can’t! The doctor says ""don't worry."" “Those are just contractions.”"
13199,What do you call LGBTQ people who are crazy? People who can’t think straight
13198,"My wife tried to unlatch our daughter's car seat with one hand and said, ""How do one armed mothers do it?"" Without missing a beat I replied, ""Single handedly.""

She didn't laugh but I hope you folks did."
13183,Jack: How’s it going? Beans: Pretty good Jack and the beans talk
13130,"my friend just told me, 'I hope you die in a deep hole filled with water'. I know he means well."
13128,"“Officer, are you crying while you are writing me a ticket?” Cop: It’s a...moving violation."
13109,"What’s the Fastest Growing City on Earth? The capital of Ireland. 

It’s Dublin every day."
13117,Why did the Mexican take a Xanax? For Hispanic attacks
13093,"Yesterday my wife completed a 36-week body building program It's a baby girl, 8 pounds, 2 ounces.

I'm a Dad!"
13084,"Got my girlfriend with this earlier we're heading through grocery store checkout. She looks over at the candies and says

""Ooh! Mentos!""

""I already have Mentos.""

""Really? Where?""

""On my men feet!"""
13079,"I had a vasectomy because I didn't want any kids. When I got home, they were still there."
13069,"Due to COVID-19, Germany is running out of sausages and cheese. The government considers this to be the Wurst Käse scenario"
13071,Where did Noah put all the bee’s in his Ark? In the Ark Hives.
13072,"I’d tell you a Fibonacci joke, but’s it’s probably as bad as the last two you’ve heard combined"
13068,"My 10 year old daughter just told me this one. ""What did the green grape say to the purple grape?"" ""Breathe you idiot, BREATHE!"" 


I've never been so proud."
13060,Why was 69 afraid of 70? Because they had a fight and 71.
13047,"Since it’s the Fourth of July, I just told my daughters they were named after George Washington. About 280 years after to be precise."
13042,"When my wife caught me standing on the bathroom scales, sucking in my stomach, she laughed, “Ha! That’s not going to help!” I replied, “Sure, it does.” “It’s the only way I can see the numbers.”"
13050,"A bear goes to the bar and says ""can I get one whiskey..................and one coke"" The bartender asked ""why the big pause""

The bear replies ""I was born with them"""
13036,"Why isn't holy water used in vaccines? Because you can't take the lord's name in vein.


Credit to my brother."
13039,I can always tell when someone is lying just by looking at them. I can tell when they're standing too.
13022,"I'm pretty bad at building fences.. Oops, wrong place for this post"
13022,"I told my son people keep accidentally pleading for me to purchase meat for them. He asked, “By mistake?” 

I shouted, “Oh come on! Not you too!”"
13012,"My friend Ty came first in the Beijing marathon, but wasn’t awarded a gold medal. The Chinese refuse to acknowledge Ty won."
13015,"Stepdaughter pun that I never thought I'd hear. Brief background: stepdaughter is 20 years old and has always hated when I make puns/dadjokes

So my step daughter just came downstairs heading out for work and just as she's walking out the door I noticed she has only one shoe on.

Me: ""Hey! You know you only have one shoe on, right?

Her: ""yeah, the other one is in my car""

Me (visibly confused): ""uh...ok""

Her: ""you might say I'm a step ahead""

The door shuts, my jaw dropped.

I run to the door, open it, 

""Was that a pun? did you just make a dad joke?!""

She replies only with a smirk.

I'm so proud."
13010,It this sub dead? There hasn't been a post all year!
12992,"What did the Reddit user say after detonating a bomb in a bank? Edit: Wow, this blew up! Thanks for the gold kind stranger!

Edit: Credit to r/Teenagers for this"
12991,"So I was out at the museum with my daughter today and got the ultimate dad joke in. Employee asks kids ""Does anyone know the difference between a Crocodile and an Alligator?"" One will see you later and the other will see you in a while?

Daughter groaned, employee laughed, other dad's nodded approvingly."
12984,"If you spell the words “Absolutely Nothing” backwards, you get “Gnihton Yletulosba,” which ironically means... Absolutely nothing."
12958,"When my wife found me playing with my son’s train set, I was so embarrassed that I threw a bedsheet over it. I think I managed to cover my tracks."
12956,"My wife is fed up of my constant Dad jokes, so I asked her, ""How can I stop my addiction?"" Wife: ""Whatever means necessary,""

Me: ""No it doesn't”"
12945,What's the difference between a vegan and a computer programmer? One is disgusted by a rack of lamb and the other is disgusted by a lack of RAM.
12949,"My friend claims the he accidentally glued himself to his autobiography, but I don’t believe him. But that’s his story, and he’s sticking to it."
12935,I love telling dad jokes. Sometimes he laughs.
12938,My left knee has never committed a crime. I can’t say the same for his felony.
12930,"Why can’t two elephants swim at the same time? They only have a pair of trunks. 

-my grandfather, just 5 minutes ago."
12915,Why is Dark spelled with a ‘K’ and not a ‘C’? Because you can’t ‘C’ in the dark
12907,"Our oldest has been obsessed with the new God of War. When he got home from school, I said ""did you hear that they have two more games planned?"" His face lit up and he asked ""really?""

""Yeah, the follow-ups to Ragnarok: Ragnapaper and Ragnascissors.""

He is currently not speaking to me."
12904,"A Mexican magician says he will disappear on the count of 3. He says ""uno, dos..."" *poof*. He disappeared without a tres."
12889,How many people with ADHD does it take to change a lightbulb? You wanna ride bikes?
12878,"I bought my friend an Elephant for her room... She said ""thanks"". I said ""don't mention it"""
12872,My girlfriend is leaving me saying I am not American enough. Saw it coming a kilometer away.
12874,My boss just told me that I’m the worst mailman he has ever seen. Shit..l meant to post this somewhere else.
12855,"Remember when air was free at the gas station, now it’s $1.50. You know why? Inflation"
12856,"I hate it when my wife suddenly says ""Are you even listening to me?"" Who the hell starts a conversation like that?"
12847,My son asked me what I'm posting on Reddit. I tell him that they /r/dadjokes.
12837,"In Ancient Rome, there were 4 types of poison. Poisons I, II, and III would all kill you with varying degrees of pain. 

However, Poison IV would just make you really itchy."
12812,The worst part about kissing a perfect 10 is How cold the mirror feels on my lips
12811,My 6 year old just told me this joke... What's stronger than a fortune cookie? A hammer.
12816,"I just saw my wife walk by with her sexiest underwear on, which can only mean one thing. It’s laundry day."
12814,"So my daughter is clearing the table and holds her cup above her head and says ""Dad look..."" ""I'm breathing underwater.""

I've never been prouder."
12804,"When my wife told me to stop impersonating a flamingo, I had to put my foot down."
12793,Her: I’m leaving. I am sick of you wearing a different t shirt every half an hour. Me: Wait. I can change.
12782,I decided to quit my job as a personal trainer because I’m not big enough or strong enough I’ve just handed in my Too weak notice.
12785,"My dad passed today. Posting this for him To clarify, he is a soccer player
Don't worry, he's still alive and kicking

Edit: I just wanted to thank everyone for the awards, and the upvotes 

Sorry if anyone found this offensive ⚽️"
12779,"They said gloves and a mask would be enough to go to the supermarket.. They lied, everyone else had their clothes on"
12778,I'm worried that the supreme court will lack empathy now that Ginsburg is gone. Without her they're ruthless.
12768,Why is “beefstew” an unsafe password to use? Because it’s not Stroganoff.
12763,"My wife emailed me our wedding photos, but I couldn’t open any of the files. I always have trouble with emotional attachments."
12761,My brother had to quit his job as a weightlifter because he wasn't strong enough. He handed in his too weak notice yesterday.
12752,What do you call an orphan taking a selfie? A family photo
12736,I like my slaves how I like my coffee.. Free.
12737,"Why do teenage girls walk in groups of 3, 5, and 7? Because they literally can’t even."
12725,A cheese factory exploded in France. Da brie is everywhere!
12700,"My wife told me to take a spider out instead of killing it. We went out and had beers. Cool guy, very driven, wants to be a web designer."
12700,"Which weighs more, a gallon of water, or a gallon of butane? A gallon of water. Butane is a lighter fluid."
12688,"I(16F) just thought of this joke and I hope it increases my chances of becoming a dad someday A man decides to make some macaroni at his home after work.
He was really tired but eventually he made a dish to be proud of. He looks around his kitchen drawers for any of his plastic forks but can’t find any so he decides to just use a spoon. A few minutes later his girlfriend comes home and asks for some of his macaroni. He complies and hands her a spoon so she can eat with him. “Why a spoon”, she asks. The man replied,

“I’ve run out of forks to give”"
12663,"I couldn't believe I got to use this Wife-Can you be serious for a minute?

Me-\*grins\* Ok and you be Shirley

Wife-I'm serious!

Me-Shirley you can't be Serious, I'm Serious

&#x200B;

This actually happened. :)"
12658,"My wife is super upset at our neighbour who happens to enjoy suntanning in her backyard naked Personally though, I’m on the fence."
12650,"What's the opposite of lady fingers? Mentos

(I will see myself out)"
12648,Bilbo Baggins suddenly wakes up and hears someone singing “Don’t stop Believing”. It was an unexpected Journey.
12620,What do you call a calculator that works instantly? Calcunow
12616,"My girlfriend asked if we could have an old movie night and watch “Gaslight” I told her “we already watched that together, don’t you remember?”"
12611,"I have a pencil that used to belong to William Shakespeare. He chewed it a lot. Now, I can't tell if it's 2B or not 2B!"
12619,I HATE HOW FUNERALS ARE ALWAYS AT 9AM I'm not really a mourning person 😔
12605,We need to uninstall 2020 and then try reinstalling it The current version has a nasty virus
12589,"6 was scared of 7 because 7,8,9 but why did 7 eat 9? Because you're supposed to eat 3 squared meals a day."
12579,"I said to my son, ""I need a battery so I can tell the time."" He asked, ""Is it for a clock?"" I answered... 

""I don't know! That's why I need the battery!"""
12580,My friend was bragging that his new 3D printer can print a gun. Big deal. I have had a Canon printer for years.
12561,What’s the difference between bird flu and swine flu? One requires tweetment and the other requires oinkment.
12555,This girl on Tinder asked me why I have an unlit cigarette in my picture... I told her I’m just looking for matches.
12547,"My wife accused me of hating her family and relatives I replied, no, I don't hate your relatives. In fact, I like your mother-in-law a lot better than I like mine."
12541,My math teacher called me average... How mean!
12546,Why is the letter B so cool? Because it’s sitting in the middle of the AC
12546,"TIL that the Ancient Romans had four types of poison. Poisons I, II, and III instantly killed the victim upon contact. Poison IV, though, just made the victim extremely itchy."
12548,I’ve asked so many people what LGBTQ stands for So far no one has given me a straight answer
12535,"A robber broke into a college bookstore & stole $20,000 worth of textbooks. Fortunately, the police were able to return both books to the school."
12515,"Got my 30 year old son with this.. Me: Son, will you remember me when I'm gone?
Son: Of course, dad.


Me: Son, will you remember me in 5 years? 
Son: yes


Me: Son, will you remember me in 5 months? 
Son: yes


Me: Son, will you remember me 5 minutes from now? 
Son: Well sure


Me: That really makes my day son! Ya wanna hear a dad joke?
Son: Of course dad I love your dad jokes!


Me: Knock Knock
Son: Who's there? 

I just stared at him shaking my head.."
12515,"I have to tell someone about this because I'm at home alone with my 2 year old and 11 month old, and they're to young to understand my best dad joke ever. My 2 year old has cereal in her snack cup and just showed me that there was a piece of cereal in her sleeve.  I said, ""Looks like you got some tricks up your sleeve.""   GUESS WHAT KIND OF CEREAL SHE WAS EATING!.....IT WAS TRIX!       
Edit: Thanks for my first gold!"
12514,"While at a restaurant, the waitress was totally flirting with me with my wife present. After she walked away, my wife said “She obviously has COVID!” “Why would you think that?” I asked. “Because she has no taste.”"
12518,"In an alternate universe, Hercules was a girl. Her name was Himcules"
12510,SCUBA is an acronym for Self Contained Underwater Breathing Apparatus. What you may not know is that Tuba is also an acronym... For Terrible Underwater Breathing Apparatus
12503,I’ve been saying “mucho” to my Spanish friend a lot more often lately It means a lot to him
12477,"When I asked my daughter what she wanted for dinner, she said with a straight face, ""uncooked boys."" Ramen. Took me second, but I was much relieved when I figured it out."
12472,My Latina wife used to seductively roll her r’s when speaking Spanish to me. But now that I’m into telling dad jokes she doesn’t do that anymore. These days she just rolls her eyes.
12478,My 3 yr old daughter made her first pun today and I almost cried. She was eating an apple and I asked her if she liked apples. She said apple-lutely
12470,What did the pirate say on his 80th birthday? AYE MATEY
12460,"If you commit 90 sins, you will get caught about half the time. Because sin90 = cot45"
12447,My son was so happy with the response to his joke yesterday he wanted me to share this one with you too. What’s the most reliable part of the human body? Your fingers. You can always count on them.
12425,"I hear it's easy to get ladies not to eat Tide pods. It's more difficult to deter gents, though."
12420,"Jeff, a semi colon, and an Oxford comma walk into a bar. They both have a great time."
12398,What's a thousand times better than Instagram? Instakilogram.
12376,"My Son's Teacher reads a joke from /r/dadjokes every morning before lessons start, but she was absent last week.. so a subreddit.."
12362,"Girlfriend got me good. Never been more proud of her. Said if she ever hosts a gender reveal party, when it comes time to pop the balloon she'll spray everyone with water.

Gender is fluid."
12365,What does “idk” stand for? I’ve asked lots of people but nobody seems to know.
12364,"A man in an interrogation room says, “I’m not saying a word without my lawyer present!"" The cop growls, ""You ARE the lawyer!"" The lawyer shrieks, ""Exactly! So where’s my present?!"""
12349,When people think of calculators they think the buttons are the most important thing But it's what's inside that counts
12329,"These aren't dad jokes... Dad jokes are supposed to be jokes you can tell a kid and they will understand it and find it funny.

This sub is mostly just NSFW puns now.

If it needs a NSFW tag it's not a dad joke. There should just be a NSFW puns subreddit for that.

Edit* I'm not replying any longer and turning off notifications but to all those that say ""no one cares"", there sure are a lot of you arguing about it. Maybe I'm wrong but you people don't need to be rude about it. If you really don't care, don't comment."
12334,"Justice is a dish best served cold, if it were served warm jt would be justwater."
12327,I've got this awful disease where I can't stop telling airport jokes. The doctor says it's terminal.
12317,I just read that someone in London gets stabbed every 52 seconds.  Poor bastard.
12313,"I am Anti-vax I am anti-vax and I don’t care what you think.
I am absolutely sick and tired of seeing people that are anti-vax getting ridiculed and
bullied on Reddit because of their choice.

You need to understand we have good reason to feel this way and that by simply attacking us or belittling us will not change our minds. We will not be silenced.

I for one will never have another one again. Not a chance in hell, I don’t care what you say to try and convince me, I’ve fallen for that trap too many times before.

They are absolutely the worst brand of vacuum cleaner ever. 

It’s Hoover or Dyson all the way for me!"
12309,"I gave my daughter a watch for her birthday. She thought it was so cool and when she showed it to the next door neighbor, he asked, ""That's a pretty watch you've got there! Does it tell you the time?"" She laughed and said, ""No, this is an old-fashioned watch! You have to look at it!"""
12305,"What do you call a fear of giants? Feefiphobia

Edit: wow! I never expected this to reach such great heights..... Thank you for the awards, kind redditors."
12292,Why Is Dark Spelled With A K and Not A C Because you can’t c in the dark
12297,"The first computer dates back to Adam and Eve. It was an Apple with limited memory, just one byte.

And then everything crashed."
12295,Seems a little inappropriate having a strip club across the road from Mini golf in town. I’m a pretty liberal guy but if I’m having a day out with my family the last thing I want to look across the road and see is a bunch of losers playing mini golf.
12282,"Ever since the pandemic started, every morning I proudly announce to my family that I’m going for a jog and then I don’t... 

It’s my longest running joke of the year so far..."
12283,My wife told me to stop acting like a flamingo. So I had to put my foot down.
12270,"Wife: I'm preganant. Me: Hi preganant, I'm dad!

Wife: No you're not."
12269,"If pronouncing all my ""V""s like ""B""s, makes me sound Russian... Then Soviet"
12263,"After my wife had given birth to our baby, the nurse asked me, ""Do you have a name yet?"" I said, ""Yes. Steve."" She giggled, ""Awww! That's a lovely name!"" I replied, ""Thanks."" ""But what do you think we should call the baby?"""
12241,What do you call the thing which ruins the ending of a movie?
12246,"Three boys go into a haunted house. One brought a knife, one brought a gun and one brought some cough drops They crept in. It was pitch black and stone quiet. They were suddenly starting to regret this dare. Stupidly, only one brought a flash light. The aggressive darkness and inky black yielded with grudging compliance but always seeming to push back. They moved cautiously onward amid the dust and cobwebs. The floor creaked. They breathed in tight, quick breaths. You could hear a pin drop.

Suddenly, there was a deep moan. ""OOOOOOOOUUUUU"". It seemed from below them. The house had been abandoned for years. Who *or what* could make such a sound? The boys looked at each other, but continued on, hearts pounding in their chests.

As they proceeded into the kitchen they encountered a swarm of flies. Buzzing and beating their necks and faces, they rushed and stumbled to the door, not stopping to see what they were truly feasting on. They slammed the door behind them. Maybe a body? But no way were they going back to find out. And again came the sound, ""ooooOOOOOooooOOUUU"" but louder this time, and closer.

They proceeded through the dark into the dining room. They saw a fully set dining table covered in cob webs. Dust-covered regal-looking glasses, goblets and silverware adorned the table. Spiders climbed on ivory plates. Clearly a house of privilege and set for a grand feast which never happened. 

Or, perhaps, met a fatal end?

They pushed on. But again that unearthly howl. 

""oooooOOOOOOOOOOOUuuuuUUUUuuUUOOOOooo"". 

They found the basement staircase, and from below, the sounds seemed to be emanating. Could they proceed? Would they? Did they dare? Two of the boys looked at each other, faces filled with worry. 

But the third said, confidently, ""We're going down there."" Not wanting to seem the weaker, the other two boys steeled themselves and nodded.

The stairs creaked and groaned evily under their feet. The rickety banister shook in angry defiance. Insects and vermin scattered underneath them with every step. They were descending into hell, they knew, but none would turn back.

And the sound: ""oOOOOOOOOUUUUUUUUuuuuUUOOOO"". Now loud enough to fill not only their heads but seeming to claw at their very souls! 

Now at the basement door! The antique, crying squeak of the hinges eeeeeeEEEEEEEEEEee made the boys wince and almost cover their ears. But they had to know. WHAT is making that horrible, terrible sound?

**""ooooooooooOOOOOOOOOOOOUUUUUUUoooooUUUUUUUOOOOOOO""**

In the center of the basement lay an unholy coffin! A twisted artistic expression of murder, decay and disease! Brutish, incorrect lengths had been forced together, buckling the wood and bulging the steel at points, as if death, itself, were attempting to escape. It was festooned with beast-like emblems and decrepid artifacts: skulls, antlers, skins, totems, and drenched in the color of blood!

It was TRUE! The house really *was* haunted!

**""OOOoooOOOoOOooOoOouuUUUUUuuuuUOOuouOUO""**

Now the boys realized with sheer horror that the insane moaning was definitely coming from the coffin! 

Before the boys could turn and run, the coffin began to shake! They froze. 

Then it suddenly LIFTED off the ground! They gaped in terror! 

Shaking violently and rising, the coffin started to turn. It turned and turned, and gained speed. It was spinning in the air before them! A mix of terror and fascination gripped them. Unable to look away. Unable to run. It spun faster and faster AND FASTER!

**""OOOoooOOOoOOooOoOouuUUUUUuuuuUOOuouOUOOOOOOOoo""**

The first boy with the knife slashed in the air in front of him, as if to stab away at the evil! Then he dropped the knife and ran back up the stairs, never to be seen again.

The second boy with the gun fired warning shots at the ceiling BANG! BANG!, but then thought better of it, dropped his gun and also ran up the stairs, and also was never to be seen again.

The third boy stood there calmly, reached into his pocket and popped a cough drop into his mouth. He sucked on it for a bit.

And the coffin stopped.

**Wow, thanks for all the love, fellow Dads!"
12234,"My dad banned me from saying ""Hell"", so I asked: ""Have you thought of any alternative names for hell?"" He said: ""I heaven't"""
12235,If Jesus was real they wouldn't call it the crucifixion They would call it crucifact.
12244,What did the pirate say when he turned 80? Aye Matey.
12229,What do you call an instagram celeb who got Corona? An influenzer.
12225,"My wife tells me I have 2 major faults, I don't listen - and something else."
12213,"In other news, Bill Nye’s daughter, Dee, came out as a Flat Earther and Anti-Vaxxer, and is starting a new organization to support the movements. The Dee Nye Science Foundation."
12216,"Chris: Hey can I borrow a ten? Kristen: Sure!

Christen: thank you 

Kris: Anytime"
12204,"A Kung Fu student asks his teacher, ""Master, why does my ability not improve? I'm always defeated."" And the master, pensive and forever patient, answers, ""My dear pupil, have you seen the gulls flying by the setting sun and their wings seeming like flames?"" 
""Yes, my master, I have.""

""And a waterfall, spilling mightly over the stones without taking anything out of its proper place?""

""Yes, my master, I have witnessed it.""

""And the moon, when it touches the calm water to reflect all its enormous beauty?""

""Yes, my master, I have also seen this marvelous phenomenon.""

""That is the problem. You keep watching all this shit instead of training."""
12205,My son asked if I could tell him what a solar eclipse is I said “No sun”
12192,"My deaf girlfriend just told me, “We need to talk.” That’s not a good sign."
12194,"Set your password to 2444666668888888 That way, you can say it's 12345678"
