upvotes,dadjoke
86878,"BREAKING: Iran has struck its own submarine with an underwater torpedo in the Persian Gulf, killing all 350 aboard Whoops wrong sub"
56956,"My offspring came out as transgender last night As far as I’m concerned, I have no son

Edit: Looks like I’m getting downvoted. Pretty sure that’s a good thing on this sub. Some people just can’t think straight"
51639,"If you can't say it to your 5 yr old kid, its not a dad joke. I'm getting really sick of all the NSFW jokes that have been hitting the front page lately. I know I'm not the only one who feels this either.
IF YOU CAN'T TELL THE JOKE TO YOUR KID, IT'S NOT A DAD JOKE.
dad jokes are clean, thats why they're ***dad*** jokes. If you have an NSFW joke, please refer to r/unclejokes.
I'm sorry if I sound whiney, but dad jokes are dad jokes and uncle jokes are uncle jokes."
48977,"Today, my son asked ""Can I have a book mark?"" and I burst into tears. 11 years old and he still doesn't know my name is Brian."
48006,"An Afghan, an Albanian, an Algerian, an American, an Andorran, an Angolan, an Antiguans, an Argentine, an Armenian, an Australian, an Austrian, an Azerbaijani, a Bahamian, a Bahraini, a Bangladeshi, a Barbadian, a Barbudans, a Batswanan, a Belarusian, a Belgian, a Belizean, a Beninese, a Bhutanese,  a Bolivian, a Bosnian, a Brazilian, a Brit, a Bruneian, a Bulgarian, a Burkinabe, a Burmese, a Burundian, a Cambodian, a Cameroonian, a Canadian, a Cape Verdean, a Central African, a Chadian, a Chilean, a Chinese, a Colombian, a Comoran, a Congolese, a Costa Rican, a Croatian, a Cuban, a Cypriot, a Czech, a Dane, a Djibouti, a Dominican, a Dutchman, an East Timorese, an Ecuadorean, an Egyptian, an Emirian, an Equatorial Guinean, an Eritrean, an Estonian, an Ethiopian, a Fijian, a Filipino, a Finn, a Frenchman, a Gabonese, a Gambian, a Georgian, a German, a Ghanaian, a Greek, a Grenadian, a Guatemalan, a Guinea-Bissauan, a Guinean, a Guyanese, a Haitian, a Herzegovinian, a Honduran, a Hungarian, an I-Kiribati, an Icelander, an Indian, an Indonesian, an Iranian, an Iraqi, an Irishman, an Israeli, an Italian, an Ivorian, a Jamaican, a Japanese, a Jordanian, a Kazakhstani, a Kenyan, a Kittian and Nevisian, a Kuwaiti, a Kyrgyz, a Laotian, a Latvian, a Lebanese, a Liberian, a Libyan, a Liechtensteiner, a Lithuanian, a Luxembourger, a Macedonian, a Malagasy, a Malawian, a Malaysian, a Maldivan, a Malian, a Maltese, a Marshallese, a Mauritanian, a Mauritian, a Mexican, a Micronesian, a Moldovan, a Monacan, a Mongolian, a Moroccan, a Mosotho, a Motswana, a Mozambican, a Namibian, a Nauruan, a Nepalese, a New Zealander, a Nicaraguan, a Nigerian, a Nigerien, a North Korean, a Northern Irishman, a Norwegian, an Omani, a Pakistani, a Palauan, a Palestinian, a Panamanian, a Papua New Guinean, a Paraguayan, a Peruvian, a Pole, a Portuguese, a Qatari, a Romanian, a Russian, a Rwandan, a Saint Lucian, a Salvadoran, a Samoan, a San Marinese, a Sao Tomean, a Saudi, a Scottish, a Senegalese, a Serbian, a Seychellois, a Sierra Leonean, a Singaporean, a Slovakian, a Slovenian, a Solomon Islander, a Somali, a South African, a South Korean, a Spaniard, a Sri Lankan, a Sudanese, a Surinamer, a Swazi, a Swede, a Swiss, a Syrian, a Tajik, a Tanzanian, a Togolese, a Tongan, a Trinidadian or Tobagonian, a Tunisian, a Turk, a Tuvaluan, a Ugandan, a Ukrainian, a Uruguayan, a Uzbekistani, a Venezuelan, a Vietnamese, a Welshman, a Yemenite, a Zambian and a Zimbabwean

all go to a bar..

The doorman stops them and says ""Sorry, I can’t let you in without a Thai."
43971,My wife just completed a 40 week body building program this morning It's a girl and weighs 7lbs 12 oz.
38822,"This just happened in real life, and I got not even a chuckle. True story: the wife and I were walking in Target this evening. We were walking in the clothing section, behind an employee who was moving a mannequin. Out of nowhere the whole arm pops off, and the poor woman can’t bend to pick it up because… ya know… she’s holding the rest of the mannequin. So I walk up, grab the limb while she’s looking around for another employee to help, hold it out to her and say…

“Here, let me give you a hand” 

She took it. No laughter. My wife? Nothing. So I am posting here in the hopes that my genius will be appreciated. Keep getting those dad jokes in the wild, folks."
38556,[warning 18+] 19
38323,Is this sub still active? There hasn’t been any posts all year.
36868,"My son asked why sStar Wars movies came out 4, 5, 6, 1, 2, 3… I answered in my best yoda impersonation: ‘in charge of scheduling, I was’

My son loved it, I heard a sigh from my SO, and when I looked at her, she just shook her head."
36637,"Putin dies and goes to hell. After a while, he's given a day off for good behavior. So he goes to Moscow, enters a bar, orders a drink and asks the bartender:

-Is Crimea ours?

-Yes, it is.

-And the Donbas?

-Also ours.

-Kyiv?

-We got that too.

Satisfied, he drinks and asks:

-Thanks. How much do I owe you?

-5 euros."
35030,"The day I turned 42, my daughter walked up to me and said ""happy..."", and started timing on her watch. After a long silence she said... ""...40 second birthday"".
I was so proud."
34988,"As I handed my Dad his 50th birthday card, he looked at me with tears in his eyes and said, “You know, one would have been enough.”"
34423,"Today I understand why dad jokes are a true stereotype Never understood why dads and corny jokes were a thing.  I did notice it's a mostly true thing.  

But I understand today.  Asked my four year old what an 8 is.  He doesn't know so I enlightened him that it's a zero with a belt.  

Lost. His. Shit.  He's just mastered numbers and letters and this was hysterical to him.  I'm the funniest man alive. He's told the joke back to me about twenty times.  Today.  

Teenagers, this is why dads tell those jokes.  They're chasing the indescribable high of this moment with a little kid.  I found them cringeworthy as a teenager, but I get it now."
33608,What genre are national anthems? Country.
32681,Gonorrhea would have been a great name for diarrhea medicine
32487,"why does dracula always bite people in the neck? Because he's a neck romancer

EDIT: getting downvoted, might have been a grave mistake posting here...

EDIT 2: getting a lot of upvotes now, I guess the Count is  rising"
32089,"If pronouncing my b's as v's makes me sound Russian, then soviet."
31712,"When you thought you’ve just about heard all the Will Smith and Chris Rock jokes already, I present you with this one 1"
30980,"A girl came into my bookstore and asked ""What are the chances you have a book on curing eating disorders with religion?"" Slim to Nun?

(Incidentally this is a true story and I got yelled at)"
30890,For those of us always looking...
29902,"Daughters boyfriend introduced himself to me he said ""Hi sir I'm david, nice to meet you"". He put out his hand and I said ""David are you nervous?""  He said no so I grabbed his  hand looked him in the eyes and said ""then why are you shaking?"""
29216,I am Buzz Aldrin. Second man to step on the moon. Neil before me.
28928,"Of all the inventions of the last 100 years, the dry erase board has to be the most remarkable."
28612,"I must admit, I joined this subreddit despite not being a dad. I’m a faux pa.

Edit: This took off a lot better than I expected.

I feel like a father figure now."
27940,What’s on Chris Rock’s Face? Fresh Prints!
27704,"Prediction: There will be a minor Baby Boom in 9 months, and then one day in 2033 we will witness the rise of The Quaranteens"
27256,"Is this sub dead? No one's posted here all decade...

(Regards from New Zealand)"
26871,"I took my 8-year old girl to the office with me on, ""Take Your Kid to Work Day."" As we were walking around the office, she starting crying and getting very cranky, so I asked what was wrong with her. As my coworkers gathered round, she sobbed loudly, ""Daddy, where are all the clowns that you said that you worked with?!"""
26651,Why was 2019 afraid of 2020 Because they had a fight and 2021
26316,"A woman was 3 months pregnant when she fell into a deep coma and woke up after about 6 months. The woman asked the doctor about her baby.

Doctor: You had twins, a boy and a girl. They're both fine. And, you're brother named them for you.

Woman: No No No! Not my brother. He's an idiot! What did he name the girl?

Doctor: Denise.

Woman:  Ohh, that's actually a nice name. What about the boy?

Doctor: *deeply sighs* Denephew."
25686,"Every day, my teacher starts her class by reading a joke from r/dadjokes, but today she is absent. So today, a subreddit."
25277,"What has 4 letters, sometimes has 9 letters, but never has 5 letters."
24824,You gotta hand it to blind prostitutes.
24760,"AITA for eating my coworker's lunch? Wait, wrong sub"
24660,"My son was just born(!) and another dad at the nursery congratulated me and said his daughter was born yesterday… said maybe they'll marry eachother. Sure, like my son is going to marry someone twice his age..."
24453,"My friend told me, “Your wife and daughter look like twins!” I said, “Well, they were separated at birth.”"
24026,It All
23907,"My wife asked me to flip the calendar to the next month... To my surprise, the calendar skipped from April to June. I turned to tell her we're missing a month.

She said, ""What's the matter? You look dis-Mayed...""

She's apparently been waiting a month for this set up"
23788,"Imagine being held at gunpoint (bear with me) by a literate animal, and the only hope of rescue is (BEAR WITH ME) posting a coded message on Reddit."
23789,"My wife screamed ""you haven't listened to a single word I've said, have you?!"" What a weird way to start a conversation.."
23601,Spring is in the air
23513,My wife found out I was cheating on her after she found all the letters I was hiding... She got mad and said she's never playing scrabble with me again
23487,I got the words “jacuzzi” and “yakuza” confused. Now I’m in hot water with the Japanese mafia.
23459,"My wife just completed a 40 week body building program this morning. It's a baby girl and weighs 7lbs 12 oz.

I am a Dad!"
23385,A man walks into a pet store and asks for a dozen bees. The clerk carefully counts 13 bees out onto the counter. “That’s one too many!” says the customer. The clerk replies “It’s a freebie”
23221,"I told my daughter, ""Go to bed, the cows are sleeping in the field."" She said, ""What's that got to do with anything?"" I said ""That means it's pasture bedtime."""
23072,"Personally, I don't believe in bros before hoes, or hoes before bros. There needs to be a balance. 

A homie-hoe-stasis, if you will."
22698,"I got an e-mail saying, ""At Google Earth, we can read maps backwards!"" and I thought... “That’s just spam.”"
22685,"If Ani is short for Anakin and Obi is short for Obi-Wan, what is Luke short for? A stormtrooper."
22491,"Karl Marx is a historically famous philosopher but no-one ever mentions his sister, Onya, the inventor of the starting pistol."
22305,Hello everyone 23 (F) here. FFFFFFFFFFFFFFFFFFFFFFF
22253,"I broke up with my girlfriend of 5 years because I found out she was a communist. I should have known, there were red flags everywhere."
22057,"My dad just died. This isn’t a joke, I’m lost. I remember at his dads funeral he told me: Why do they put fences around cemetery’s? Because people are dying to get in. 

I told my daughters this joke years ago and told them it was from my dad. I want a joke that I can make at his funeral to my children in his honor. Can you help me out?"
22046,BREAKING NEWS from the courtroom! Amber Heard confesses to having a child with Charlie Sheen. The child went to live with his father and took his name. Both parents agreed the child should be sheen and not heard.
22032,"My wife accused me of hating her family and relatives... 
I replied, ""No, I don't hate your relatives. In fact, I like your mother-in-law a lot better than I like mine."""
21910,"BREAKING NEWS: Eminem has just become the first celebrity to be diagnosed with Coronavirus.. In a statement released by doctors, it has been revealed that his palms were sweaty, knees weak and arms were heavy.. He presented with vomit on his sweater already.. Initial testing has revealed it was mums spaghetti"
21855,"There was an old man who lived by a forest. As he grew older and older, he started losing his hair, until one day, on his deathbed, he was completely bald. That day, he called his children to a meeting... He said, ""Look at my hair. It used to be so magnificent, but it's completely gone now. My hair can't be saved. But look outside at the forest. It's such a lovely forest with so many trees, but sooner or later they'll all be cut down and this forest will look as bald as my hair.""

""What I want you to do..."" the man continued. ""Is, every time a tree is cut down or dies, plant a new one in my memory. Tell your descendants to do the same. It shall be our family's duty to keep this forest strong.""

So they did.

 Each time the forest lost a tree, the children replanted one, and so did their children, and their children after them. 

And for centuries, the forest remained as lush and pretty as it once was, all because of one man and his re-seeding heirline."
21793,"I saw my wife, slightly drunk, yelling at the TV: “Don’t go in there! Don’t go in the church, you moron!” She is watching our wedding video again."
21567,The female janitor at my building asked if I would chill and smoke some weed with her. I said no. I can't deal with high maintenance women.
21410,Where do you take someone who’s been injured in a peak-a-boo accident? To the I.C.U.
21219,"My landlord texted saying we need to meet up and talk about how high my heating bill is. I replied back: “Sure, my door is always open.”"
21132,"Asked my son what he learned at school today. He said, “Gay men like Sony, lesbians favor Yamaha, and transgender people prefer Bose.”  Kneeling down I put my hand on his shoulder and replied, “Son, those are just stereo types.”"
21082,Is it raining?
20963,"Just happened, proud of myself: just had a quick office zoom meeting with a lot of people. As each person popped on zoom made that “DING DONG” sound. One of my bosses said “anyone that can figure out how to make Zoom stop doing that is gonna get a prize.” I said “are you gonna give them the No-Bell prize?”

I HAVE WON THE DAY"
20846,"My friend asked me if I wanted to hear a really good Batman impression, so I said go on then. He shouted, “NOT THE KRYPTONITE!” and I said, “That’s Superman…”  “Thanks, man, ” he replied, “I’ve been practicing it a lot.”"
20740,"TIL that the passengers of the missing Titanic sub should have been using a submarine certified to withstand 4000 meters of pressure, but are using a submarine that is only certified to withstand 1300 meters whoops wrong sub"
20610,"My wife kicked me out because of my terrible Arnold Schwarzenegger impressions, but don't worry. I'll return."
20577,"I think the girl at the Airlines check-in just threatened me. She looked me dead in the eye and said, “Window or aisle?”
I laughed in her face and replied, “Window or you’ll what?”"
20555,If Jada Smith doesn’t like jokes about alopecia then that’s hair loss
20524,"My dad died when we couldn't remember his blood type As he died, he kept insisting ""be positive"", but it's hard without him."
20517,"Was watching Star Wars with my daughter. She asked why Luke was climbing inside a Tauntaun, I said to keep warm. She asked how warm is it inside. I replied Lukewarm."
20378,"It's a 5 minute walk from my house to the bar, but a 45 minute walk from the bar to my house... The difference is staggering"
20327,"Dropped my best ever dad joke & no one was around to hear it For context I'm a Refuse Driver (Garbage man) & today I was on food waste. After I'd tipped I was checking the wagon for any defects when I spotted a lone pea balanced on the lifts.

I said ""hey look, an escaPEA""

No one near me but it didn't half make me laugh for a good hour or so!

Edit: I can't believe how much this has blown up. Thank you everyone I've had a blast reading through the replies 😂"
20165,"My 12 year old daughter hit me with this one last night. Daughter: “Dad, do you know how non-binary people harm each other?”

Dad: *Puzzled, confused look* “Um, no…how?”

Daughter: “They / them”. (They slash them)

Dad: “I’m so proud”"
20094,"I wrote down the names of all the people I hate on a piece of paper, but my roommate used it roll up a joint. Now he’s high on the list of people I never want to talk to again."
20103,"As an American, it’s sad to see that nothing is made in the USA anymore I just bought this new TV and it says “Built in Antenna.” I don’t even know where that is."
19951,"What has five toes but isn't your foot? My foot.









Edit: Thanks a lot guys for the awards and upvotes. ;) :)"
19943,"Every day, my teacher reads a joke from Reddit to start the class, but today she is absent. So instead, a subreddit."
19908,The COVID19 situation has been especially stressful for the Flat Earth Society. They fear that the social distancing measures could push people over the edge.
19893,I think i have a fetish for the last paragraph in an essay I just came to that conclusion
19868,"I never understood why they named the show ""SpongeBob"" Patrick was literally the star of the show"
19839,The average person is really mean
19794,"I asked my wife if I’m the only one she slept with She said “yes, all the other guys were at least a seven or an eight”"
19653,"How do you get a farm girl to marry you? First, a tractor."
19648,Did you know that 10+10 and 11+11 are the same 10+10=20 11+11=22
19605,I've just been accepted for a senior position at the Old McDonald's Farm.. I'll be the new CIEIO..
19607,"I caught my son chewing on electrical cords. So I had to ground him. He’s doing better currently, and now conducting himself properly."
19527,"I was so exhausted when I went to bed that I slept right through my son and his friends having a raging weed and heavy metal party in the yard all thru the night. As the sun came up, the party was still in full swing and my phone had blown up with messages complaining about the noise and the smell. So I wake up in the morning and I step outside and I take a deep breath and I get real high and I scream from the top of my lungs ‘WHAT’S GOIN’ ON?’

Edit: so happy that one of my home-made dad-jokes is so well-received :) thanks, everyone!"
19499,My girlfriend said she'll leave me if I don't support Trump. I said okay... Bi den.
19421,"OC posted in honor of my dear father-in-law, who died of cancer today Apologies for not following the usual formatting. My father-in-law was diagnosed with lung cancer a few months ago. A few weeks ago, we learned it had spread to his brain. Later that day, he told me: 

“Well, everyone came by after they heard about the lung cancer and told me how strong and great I am, and that I’d beat lung cancer...”

*pauses for effect*

“...I guess I let it go to my head.”

Edit: thank you all for the kind words (and the silver/gold/platinum...I’ll be making matching gifts to St. Jude’s or a similar organization). 

Yes he was a great man. At age 20 he was given 3 months to live due to another ‘incurable’ disease. He stuck around for another 45+ years. I could go on and on..."
19412,[NSFW] Strippers don’t have air conditioning in their house Onlyfans
19390,"To all of you who have been disowned by fathers. In honor of pride month and on behalf of all dads of R/dadjokes I just wanna say, buffalo. Because you can always be our bi-son, and even if you don't feel like shooting straight, we will always be trans-parent with you. You are loved."
19307,[NSFW] This one is a bit tasteless. So be warned. Water.
19232,"We just bought our new dream house and as I was showing our daughter around for the first time, she asked excitedly, ""What's upstairs!?"" I chuckled and replied, ""Awwwww sweetie...."" ""Stairs don't talk!"""
19185,"When my father said he had a 'Dad bod', I wanted to correct him so I said ""No, to me it's more like a FATHER FIGURE."""
19033,"Successful Dad joke I just pulled off on wife. Full groan and everything Wife: why do dad's have the worst jokes?

Me: It's a rule, dads have to have cringy jokes

Wife: Who makes those rules?

Me: The Dad Poet Society

Wife: *groan*"
18997,An open letter to the mods of r/dadjokes: C
18981,"A chemist froze himself to -273.15°C and everyone called him crazy but personally, I think he was 0K"
18937,"If Snoop Dogg dies before pot becomes legal in the US, He will be rolling in his grave."
18848,"""Your underwear is much too tight and very revealing."" I said to my wife. She said, ""Wear your own then, dickhead."""
18842,I just called GameStop Customer Service... They asked me to please Hold. 💎🤲
18826,My wife has this weird OCD where she arranges the dinner plates by the year they were bought. It’s an extremely rare dish order.
18814,"My Grandfather survived Pepper spray and Mustard gas attacks in two wars... ... And came home to us  a seasoned Veteran.

Edit : To use a war pun.. "" Wow, this really blew up "" ...Thanks to all for contributing to this bit of fun. I feel like Granddad now with all the medals."
18720,"A kid is pouring himself some milk. His dad walks into the room and asked, ""what kind of milk is that?"" Kid says, ""Soy milk"". Dad replies with, ""Hola milk, soy dad."""
18623,"A chemist accidentally froze himself at -273.15C Don't worry though, he's 0K

EDIT: Y'all need to chill with the puns 🤣"
18566,"TIFU by mixing up my coworkers' sandwich orders and not giving them what they requested. Sorry, wrong sub."
18414,"My daughter asked me what I'm posting on Reddit... 

I told her that they /r/dadjokes…"
18404,Someone asked me to name 2 structures that hold water. I was like well damn.
18348,"NSFW jokes just don't really feel right in this sub I've been in this sub for a year or 2 and I absolutely love it. One thing that has kinda annoyed me is that NSFW jokes are posted here. Don't get me wrong I don't hate them, I usually like them it just feels out of place; they feel more suited for r/unclejokes. Maybe this is just me seeing dad jokes as more child like or dorky puns not as more adult only type of jokes. I definitely understand if this is an unpopular opinion but it has just been something I have noticed since I have been on the sub.

Edit: for those of you looking for the punchline I regret to inform you we ran out 2 hours ago I didn't expect so many people to show up I'll prepare better next time."
18327,"My wife screamed in pain during labour so I asked, ""What's wrong?"". She screamed. ""These contractions are going to kill me!!"" ""I am sorry, honey."" I replied. ""What is wrong?"""
18316,"I built a model of Mount Everest and my son asked, “Is it to scale?” I replied, “No…” 

“It’s to look at.”"
18284,"My 16yo son was on a long video chat with his girlfriend and wouldn't come out of his room for dinner. I barged in and yelled: ""Son, I got ya that hemroid cream you asked for.""

He died laughing. His girlfriend died laughing. His girlfriend's mom was on screen in the background, she died laughing.

It was a good hit. Glad I he's dating a girl who saw the humor in it."
18259,Why did the Mexican take anti-anxiety medication? For hispanic attacks
18229,"Did you hear about the italian chef that died? He pasta way. We cannoli do so much. Theres nutelling what can happen next... His legacy will become a pizza history. Here today, gone tomato. I can only espress-so much grief, but lettuce romaine calm. How sad that he ran out of thyme. Ashes to ashes, crust to crust. There's just not mushroom left for italian chefs in this world... Sending olive my prayers to his family. His wife is really upset, cheese still not over it... You never sausage a tragic thing. Its such a shame good people die fusilli reasons. It was a farfalle from grace... My condolences for Roberto, who died in the spaghetto. May he rest in yeast🙏🏻❤️


Wow! Im so glad so many people laughed at this joke, I got so much happy feedback from everyone lol thank u sm for all the rewards and upvotes, my week couldnt get better!😁"
18222,"In spite of all our disagreements on Reddit, I’m glad about one thing. Every one reading this is on the same page.

Edit: Thanks guys. This is way too much love."
18153,"My wife said, “You really have no sense of direction, do you?” I said, “Where did that come from?”


Edit: Thanks for the love. I’m right speechless."
18150,"Dude, where’s my"
18042,"Groaned a whole store with this one. I was buying new tires for my car. While I was discussing my options the person down the counter was flustered at the prices she was being offered.  To this she loudly asked:

""I put the same ones on my husbands Jeep last year! What happened? Why are they so expensive?!""

To which I looked at over and loudly stated. ""Inflation.""

The guys behind the counter laughed. The rest of the room groaned out a chorus of dadjoke music that should have been filmed live in front of a studio audience."
18034,The guy who stole my diary died yesterday. My thoughts are with his family.
17997,"My dad always said, “ Find a girl with an embarrassing tattoo and try to convince her to marry you.” “She knows how to make bad decisions and stick by them.”"
17961,I’ve got this awful disease where I can’t stop telling airport jokes My doctor says it’s terminal
17956,"I was walking down the street where the houses were numbered, 64k, 128k, 256k, 512k, and 1MB. That was a trip down memory lane."
