upvotes,dadjoke
12190,"I told my parents I was bisexual My dad asked, ""so you like both men and women?""

I responded with, ""yeah, but I'm not seeing anyone right now""

He said, ""so you must be on stand-bi"""
12192,"Mahatma Ghandi, as you know, walked barefoot most of the time, which produced an incredible set of callouses on his feet. He also ate very little, which made him rather frail. Plus, with his odd diet, he suffered from bad breath. This made him a super calloused fragile mystic hexed by halitosis.

Edit: I do now realize I misspelled Gandhi. I cannot edit the title, just know that I see it and  am sorry."
12182,Why couldn't the green pepper practice archery? because It didn't habenero . .
12189,"My son is studying to become a lawyer, so I texted him, ""If you tickle a man to death by accident..."" ""Is it manslaughter?!"""
12186,"When I was younger, I felt like a man trapped in a woman's body ... Then I was born"
12180,"What do you get when you eat 3.14 cakes? You get fat. What, were you expecting a pi joke? Reddit doesn’t have pie days!"
12173,"We have a strict hierarchy policy for PPE usage at my office... Regular workers must wear small face shields, while Managers get to use the super-visors."
12167,"My son asks me, ""What does gay mean?"" Me:  ""It means 'happy,""

Son: ""Oh, so are you gay, then?""

Me: ""No, son, I have a wife."""
12173,Today I learnt that humans eat more bananas than monkeys I can't remember the last time I ate a monkey
12162,What is Yoda’s last name? Layheehoo
12149,An open letter to the mods and members of Dadjokes: C
12143,Why is Pavlov's hair so soft? Because he conditions it.
12127,"My wife to our son, ""Go brush your teeth with your sister"" Me from the other room, ""No, use a toothbrush""."
12110,"(Warning: Morbid dad joke) True Story -- My family were planning my mum's funeral. We always try to keep things light and try to stay positive, just as Mum would have it... The funeral director was asking us what we think Mum should wear in her casket. 

Mum always loved to wear sarongs (fabric wraps that go around the torso and drape downward a bit like a long skirt would), so my uncle suggested that she wear a sarong in there.

The funeral director looked a bit confused, as did some of our family members, to which my uncle added:

""What's *sarong* with that?""

I started laughing like an idiot. He was proud of it too. The funeral director was rather shocked. We assured her, and our more proper relatives, that Mum would've absolutely loved the joke (which is very true).

His delivery was perfect. I'll never forget the risk he took. We sometimes recall the moment as a way help cushion the blows of the grieving process.

--Edit--
I appreciate the condolences. I'm doing well and the worst is behind me and my family. But thanks :)

--Edit--
Massive thanks for all the awards and kind words. And the puns! Love 'em."
12107,Dad jokes are the best and here's why Why
12103,"What starts with T, ends with T, and is full of T? Teapot"
12093,"My missus asked Siri. ""Surely it's not going to rain today?"" Siri said ""Yes it will rain, and don't call me Shirley"". 
I think she forgot to take her phone off Airplane mode."
12092,My wife told me I was terrible with directions So I packed up my things and right
12077,"My daughter, 8, asked me what happens to frogs who illegally park their cars. ""I don't know,"" I said.

With a gleam in her eye, she squealed ""They get toad!!""

Dad win there."
12073,Why do some people post long jokes here? This isn't where they be long.
12048,Shout out to the people asking what the opposite of in is. >
12048,"100 years ago everyone owned a horse… And only the rich had cars.

Now everyone has cars, and only the rich have horses.

The stables have turned."
12047,"When you're in California, make sure your mechanic uses a state flag to check your oil. Then you'll get a ""Super Cali-Flagger Dipstick Expert Diagnosis.""


Edit: Thanks for the Platinum stranger! Wow!"
12046,"So proud of my 6 year old. While teaching her to hit a softball, I told her to “square up on the ball” She replied “the ball is round daddy” (with a straight face) So I tell her “no, what I mean is, get mad! I want you to hit the ball really hard like if you were mad at it!” 

She grabs the ball, stares right at it and says “I’M REALLY DISAPPOINTED IN YOU, BALL!” Then throws it right back at me. 

Proud dad moment."
12035,"“Have you heard of Murphy’s law?” “Yeah.” “What is it?” “If something can go wrong, it will go wrong.” “That’s right. Have you heard of Cole’s law?” “No, what is it?” “Thinly sliced cabbage and mayo.”"
12022,English puns make me feel numb But math puns make me feel number
12009,Did you know there’s no official training for a garbage collector? They just pick it up as they go.
12007,[NSFW] What do you get if you mix human dna and whale dna? Kicked out of SeaWorld.
12001,"My wife asked me, “Why don’t you treat me like you did when we were first dating!?” 

So I took her to dinner and a movie then dropped her off at her parents’ house..."
12000,"There are only two white people in the movie Black Panther Martin Freeman, and Andy Serkis.

They also play roles in Lord of the Rings.

I guess that makes them the Tolkien white guys."
11996,"A lumberjack went in to a magic forest to cut a tree. Upon arrival, he started to swing at the tree, when it shouted, “Wait! I’m a talking tree!"" The lumberjack grinned, “And you will dialogue!"""
12000,"I angered two people today by calling them hipsters... 

Apparently, the correct term is conjoined twins..."
11994,"If you become seriously depressed, try drinking a gallon of water just before you go to bed. That will give you a reason to get out of bed in the morning."
11968,The first photograph of a black hole was released It sucks
11973,"Why did The Joker have to sleep with his lights on? Because he was afraid of the Dark Knight.

—

My 9yr old son just told me this 🤪"
11964,"I hate telling people I'm a taxidermist. When they ask, ""So, what do you do for a living?"" I just say, ""Oh, you know... stuff."""
11956,What starts with an “O” and ends with “nions” and sometimes make you cry?  ***Opinions.***
11947,"What’s the difference between a piano, a tuna fish AND a pot of glue? You can tuna piano, but you can’t piano a tuna."
11952,My wife kicked me out the house because of my bad Schwarzenegger impressions. But don’t worry... I will return
11953,"I think my wife is secretly putting glue on my antique weapon collection. She denies it, but I’m sticking to my guns."
11934,"As we were driving down the road, ""Sweet Caroline"" came on the radio. I said to my son, ""Little known fact, Neil Diamond used to be called Neil Coal."" ""Until the pressure got to him."""
11920,"My wife told me if this gets 1000 upvotes, I can get anal for my birthday Please upvote. I’m having people over and need this place spotless.

Edit: thanks so much all! I showed her the post results and all she could say was, “when did I ever say that?” So anyway, if I stop staking my meds now, I should be able to have everything in order the way I need it to be for this weekend. I can already feel the knots in my stomach tightening."
11921,"My father’s name is Lee. My name is Riley. As a kid, if I ever said the word “apparently”, he would interrupt to shout “A Son Riley!”"
11909,"Cop: ""are you high?"" guy: ""am I what?"" cop: ""high"" Guy: ""hello"""
11905,"""Dad, how do you cast spells?"" ""You just follow the instructions.""

""Which instructions?""

""Yeah, they're the ones."""
11897,"My friend said, “You have a BA, Masters and a Ph.D., but you still act like an idiot.” It was a third degree burn."
11893,"I used to get heartburn whenever I ate birthday cake... ... until the doctor told me to take the candles off first!

Happy cake day to meeeeee!"
11883,How come no one at the kings table laughed when he farted? Because noble gases don't cause reaction
11881,"My wife left me because I'm insecure. Oh, no, wait, she's back. She just went for groceries."
11865,"What do we want? Low flying airplane noises When do we want it

Neeeooooooow"
11862,"Last Thursday my son was moping around and I told him, if you think Thursdays are sad, just wait two more days. He asked why? Because it'll be sadder day."
11863,The person who invented autocorrect should burn in hello.
11851,"My boss said, “I find it highly suspicious that you are only sick on weekdays.” I said, “It must be my weekend immune system.”"
11843,I met some chess players in the hotel lobby. They were bragging about how good they are. It was Chess nuts boasting in an open foyer.
11829,"How does a train eat? It goes *chew,chew*

Edit: thanks to all those who commented on this thread! I love you guys <3"
11828,"My wife said to me: ''Why don't you treat me like you did when we were first dating?'' So I took her out to dinner, to a movie, 
then I dropped her off at her parents' 
place."
11829,What do you call a line of men waiting to get haircuts? A barberqueue
11819,what do you call a communist sniper a marxman
11818,My wife asked me: “What starts with F and ends in K.”  I said: “No it doesn’t.”
11789,Looks like October is... Octover
11785,"How much does Santa pay to park his sleigh? Nothing, it's on the house."
11778,"My 11yo daughter just made up a joke. What do politicians thing of themselves? That they're politicool...

Im biased but i think its genius"
11776,"4 men were sitting in a boat about to smoke a cigarette, when they realized they didn't have a cigarette lighter. So, they threw one cigarette off their boat and the boat became one cigarette lighter."
11774,Is it crazy how saying sentences backwards…. Creates backwards sentences saying how crazy it is
11769,"I bought a new pair of gloves today... ...but they're both ""lefts"".  Which on the one hand is great, but on the other, it's just not right."
11772,Bill and Melinda Gates got divorced. Melinda got the house... But Bill kept the Windows
11757,"""Hey dad, what does gay mean?"" The boy asked his dad wife bad"
11755,"From my 7yr old daughter: Why was the pig covered in ink? Because he lived in a pen!



So very proud!"
11750,"If A is for apple and B is for banana, what is C for? Plastic explosives"
11754,"Where do mansplainers get their water? From a well, actually.."
11742,My girlfriend got mad at me for being lazy It's not like I did something
11728,"I don’t usually tell dad jokes. But when I do, he laughs."
11708,"In a recent poll, 80% of people in America said they would not open their homes to a sentient water basin that walked up to their door and asked for shelter. Let that sink in."
11692,Why can pirates never finish the alphabet? Because they always get lost at C.
11686,"My wife: You need to do more chores around the house. Me: Can we change the subject?

Her: Ok. More chores around the house need to be done by you."
11683,"I told my wife I'll never vaccinate our kids She freaked out and shouted ""What?!!! Why??!!!""

I told her:

""I would rather have a doctor do that"""
11677,"My wife asked me ""what starts with f and ends with k"" I said ""No, it doesn't""."
11661,"There's a fine line between a numerator and a denominator Only a fraction of you will understand that

&#x200B;

Edit: I see this joke has been quite divisive! Thank you to everyone who made this joke a thousand times better in the comments, you're all amazing, and thank you for the awards!"
11656,What kind of a prize do you give someone who hasn't moved a muscle in a year? A trophy.
11655,"How many reddit protestors does it take to change a light bulb? None reddit protestors don't change anything.

Too soon?"
11643,"The elderly wife in church turned to her husband and said, “I’ve just done a silent fart. What should I do?” He said, “Change the batteries in your hearing aid”."
11643,The deaf girl didn’t show up to her court case yesterday She lost her hearing.
11624,"DAD JOKES ARE NOT DIRTY. Go post NSFW jokes somewhere else. If I can't tell my kids this joke, then it is not a DAD JOKE.

If you feel it's appropriate to share NSFW jokes with your kids, that's on you. But a real, true dad joke should work for anyone's kid. 

Mods... If you exist... Please, stop this madness. Rule #6 should simply not allow NSFW or (wtf) NSFL tags. Also, remember that MINORS browse this subreddit too? Why put that in rule #6, then allow NSFW???

Please consider changing rule #6. I love this sub, but the recent influx of NSFW tagged posts that get all the upvotes, just seem wrong when there are good solid DAD jokes being overlooked because of them.

Thank you,

A Dad."
11630,"A rope walks into a bar. The bartender looks up and says says, “Get out. We don’t serve rope in here.” So the rope goes out, cuts itself in two before tying the two sections together. It then pulls out a comb and combs its ends. The rope then walks back into the bar. The bartender says, “Hey! Aren’t you the rope that I just threw out?” 

The rope replied, “No. I’m a frayed knot.”"
11611,"A wife asks her husband, ""Could you please go shopping for me and buy one carton of milk and if they have avocados, get 6. A short time later the husband comes back with 6 cartons of milk.  

The wife asks him, ""Why did you buy 6 cartons of milk?""

He replied, ""They had avocados."""
11600,I accidentally sprayed deodorant in my mouth Now when I talk I have a weird axe scent
11595,"What’s the 9 letters of the pirate alphabet? (CORNY ALERT) R, I, and the seven c’s"
11593,How much do dumplings weigh? Wonton
11588,How do you get a farm girl to like you? A tractor
11587,"My girlfriend started lying to me because of all my bad jokes. We have always been such a happy couple and everything was fine for 3 years straight. Of course I always felt comfortable in front of her and felt like I can tell her anything. That's where I was wrong.

A few months ago I noticed that she became annoyed by my dumb jokes that were only funny to me, but that just made it even funnier to me so I continued telling all these dad jokes to her and died laughing every time.

She puts up with it because she loves me. At least I thought so.

We were always 100% honest with each other and I'm still shaken by the things she told me today.

I sent her probably one of my worst dad jokes ever (that I stole from reddit), and she just couldn't take it anymore and told me how stupid my jokes are and that she doesn't know if she'll be able to put up with it much longer.

But that's not the worst part, I actually appreciated her honesty and considered the possibility to stop with all the stupid jokes and become more serious in the relationship.

The worst part is that she lied to me for the first time in all these years. I felt like I just couldn't trust her anymore and everything I thought I knew about her as a person just became questionable. I need your advice on how to react to this huge lie...

She told me she's Sorry, but I know for a FACT that her name is Diane."
11576,"Went to GameStop to use the bathroom, but it was out of order... I guess I have to keep holding it."
11571,"Went to a diner with a couple I know. They started arguing. Normally, I'm not one to take sides, but they were so distracted by yelling at each other that I stole her fries and his cole slaw..."
11571,How do you get a Redditor to open a post?
11535,"Semi NSFW! I was sitting on the toilet while my wife was in the bathtub next to me... I was just having a pee, and I thought standing up so close to her face would be rude, so I sat down.

We were having a conversation, and a minute or two in, she says ""I thought you had to pee?""

I said, ""I did, you missed it.  I'm a pterodactyl!""

She looked confused.  ""What, are they known for peeing ...  steathily?""

I could barely choke back the laughter as I coughed out...

&#x200B;

\*""... the P is silent.""\*"
11531,"If Dwayne Johnson had downstairs neighbors, they would be clueless about just about everything. You would be too if you lived under a Rock."
11533,I hear coronavirus porn is trending. What a bunch of sick fucks.
11519,I think it’s weird that we call childbirth delivery. It should have been called takeout instead.
11522,I was wondering why Music was coming from my printer.. Apparently the paper was Jamming.
11514,"We were eating dinner tonight, when my daughter said to me, “I see your glass is empty. Would you like another one?” I said, “Why would I want two empty glasses?”"
11515,"My son asked: “Dad, have you seen my sunglasses?” I replied: “No son, but have you seen my dad glasses?”"
11517,Is my wife dissatisfied with my body? A tiny part of me says yes.
11509,I bought my wife a fridge as an anniversary present. I can’t wait to see her face light up when she opens it.
11513,"Right after being born, my newborn daughter wouldn't ""latch"" for her first feeding. So after 27-plus hours of labor and four hours of pushing, I looked at my poor, exhausted wife and said, ""Looks like she's... resisting abreast."" My first *official* dad joke.


Edit: Thanks for the gold, kind stranger! I’ll be putting this in my little one’s Reddit Scholarship Fund!"
11505,"The wedding was so touching that even the cake was in tiers.

Edit: Thank you so much guys! I never expected this to reach 10k upvotes! You guys truly made my day."
11496,I get depressed if I don’t play video games. I always need to console myself.
11502,"My wife said ""nothing rhymes with orange""  I said ""No it doesn't"""
11496,"John Travolta tested negative for coronavirus last night Turns out it was just saturday night fever

(Taking advantage of a very narrow humour window!)"
11493,NSFW I bought a safe for my home
11492,No more Suez Canal jokes! That ship has sailed.
11487,"A horse walks into a bar. The bartender says ""You are in here a lot, do you think you have a drinking problem?"" The horse says, ""I don't think so,"" then disappears into nothing.

 This is the point in time when all the philosophy students in the audience begin to giggle, as they are familiar with the philosophical proposition of Cogito ergo sum, or I think, therefore, I am.  The classic philosophy put forward by René Descartes.

But to explain the concept aforehand would be putting Descartes before the horse."
11477,What’s the difference between Dubai and Abu Dhabi The people of Dubai don’t like the Flintstones but the people of Abu Dhabi Do.
11469,Who led the Jewish people across a semi permeable membrane? Os-Moses.
11463,"r/coronavirus is officially the fastest-growing community on Reddit It must be viral.

Edit: OMG Thank you for the gold, kind stranger!"
11443,"My son asked me what an updog was. I told him it was an older version of a henway.

“What’s a henway?” My son asked.

“About 5 pounds” I replied."
11443,I don’t get any of these dad jokes in this community!!!! I must not have Reddit right.
11448,I'm using only fans right now and it's hot. I'm waiting for a technician to get my air conditioner fixed
11447,I'm sick of you guys posting dumb wordplay in here for awards and upvotes. Don't you know a good pun is its own reword?
11445,Warning! This one is over eighteen. 1/18
11441,"To all the members of this subreddit, an open letter: C"
11431,A good percentage of my friends are Nazis 0%. 0% is a good percentage of nazi friends to have
11433,"A priest, a pastor, and a rabbit walk into a blood donation clinic. The nurse asked the rabbit, “what is your blood type?”

“I am probably a type O” said the rabbit."
11421,"My buddy went bald years ago, but still carries around an old comb with him. He just can’t part with it."
11404,To the person who stole my spectacles. I will find you. I have contacts.
11402,How can you turn a rectangle into a line? >!\_\_\_\_\_\_\_\_\_\_\_\_\_\_\_\_\_\_\_\_\_\_\_\_\_\_\_!<
11394,Who was the Greek god of cleavage? Paratitties
11394,How many Germans does it take to screw in a light bulb? Only one: they are very efficient and have no sense of humour.
11398,"If number 666 is evil,then 25.8069758011 is the root of all evil."
11381,"Cop: I’m arresting you for illegally downloading the entire Wikipedia! Man: Wait, I can explain everything!"
11382,"Once a man said to God ""What's a million years to you?"", and God said ""A second."" So the man said to God ""What's a million dollars to you?"", and God said ""A penny."" So the man said to God ""Would you give me a penny?"" God stopped and said ""Yes I will, just a second."""
11371,"A man obsessed with trains finally steals one and immediately crashes it, killing several people.   

At the trial, the man is found guilty of multiple murders and sentenced to death.  

Before he faces his sentence, he’s offered a last meal, and asks for a single banana, which is given to him.  

The next day, he’s led to the electric chair.  They strap him in, pull the switch, and... nothing happens.  

There’s never been a failure before.  But because you cannot punish a person twice for the same crime, the court is forced to let him go free.  

Within a week’s time, naturally, the man, who is obsessed with trains, goes and steals another one.  

He doesn’t care that he can’t drive it or that he failed catastrophically before; he is obsessed with trains and his only desire is to operate one.  As before, he crashes it, and kills several people.  

Again, he stands trial, and again, he is sentenced to death, showing no remorse, only delight that he got to operate the train.  

His last meal request is a single banana.  When he goes to the chair, the executioner pulls the switch, but nothing happens.  He goes free again.  

The train-obsessed maniac, once more on the loose, wastes no time in hijacking a train and crashing it.  

His trial is speedy, because this has already happened twice, and he is sentenced to death.  

They ask him what he’d like for his last meal.  “A single banana,” he says.  

“Oh, no you don’t, you son of a bitch.  We’re on to you, now.  We know all about your little banana trick, and you’re not escaping this time!”

The guards refuse his request, and instead serve him a standard last meal of steak, potatoes, and berry cobbler.  

The next morning they strap him into the electric chair, pull the switch, and... nothing happens.  

“*Did you give him the banana?*” demands the head guard.  

“No, sir!  He asked for the banana but we didn’t give it to him, we swear!” says one of the guards.  

Turns out the banana had nothing to do with anything.  He was just a really bad conductor."
11375,"When the moon hits your knees, and you mispronounce trees Sycamore"
11367,"Seven has ""even"" in it. That's odd."
11377,"Bill Gates meets Arnold Schwarzenneger at a party and asks him if he's upgraded to Windows 10 yet? Big Arnie replies.......  ""Ah still love Vista Baby....."""
11365,"How does two German car enthusiast cowboys greet each other? Audi, partner 🤠"
11360,"As a new language, Braille is not that difficult to learn. You just have to have a feel for it."
11354,My drunk friend was kicked out of Karaoke for singing “Danger Zone” 7 times in a row. He had exceeded the maximum number of Loggins attempts.
11351,"My boss texted me ""hey send me one of your funny jokes"" I replied ""I'm working at the moment, I'll send you one later""

He replied ""ha that was hilarious. send me another one"""
11342,"A man walks into a bar with a small newt on his shoulder. The bartender said, “What an interesting pet. What’s his name?” “Tiny,” the man replied. The bartender said, “That’s an odd name. Why did you call him Tiny?” “Because he’s my newt.”"
11337,"A woman goes to her boyfriend's parents' house for dinner. This is her first time meeting the family and she is very nervous. *long* (NSFW) They all sit down and begin eating a fine meal. The woman is beginning to feel a little discomfort, thanks to her nervousness and the broccoli casserole. The gas pains are almost making her eyes water. Left with no other choice, she decides to relieve herself a bit and lets out a dainty little fart. It wasn't loud, but everyone at the table heard the poot. Before she even had a chance to be embarrassed, her boyfriend's father looked over at the dog that had been snoozing at the women's feet, and said in a rather stern voice, ""Ginger!"" The woman thought, ""This is great!"" and a big smile came across her face. A couple minutes later, she was beginning to feel the pain again. This time, she didn't hesitate. She let a much louder and longer fart rip. The father again looked at the dog and yelled, ""Dammit, Ginger!"" Once again the woman smiled and thought, ""Yes!"" A few minutes later the woman had to let another one rip. This time she didn't even think about it. She let rip a fart that rivaled a train whistle blowing. Again, the father looked at the dog with disgust and yelled, ""Dammit, Ginger, get away from her before she shits on you!""

Edit - thanks for the awards!  I posted this before bed - wow!

Edit 2 - All you Redditors giving this the wholesome award have gas problems.  LOL!

Edit 3 - Dayum!  Thanks for ALL the awards Redditors!!"
11331,"Bruce Lee was fast, but he had an even faster brother … Sudden Lee"
